,Title,Description,Date,Source,Urls
112,"Dalmia Bharat, KEI Industries, Tata Technologies, South Indian Bank Q3 Results Today—Earnings Estimates","Aditya Birla Real Estate, Ashirwad Capital and Bacil Pharma will also declare their Q3 earnings on Tuesday.",6.5 hours ago,— Bloomberg Quint,https://www.ndtvprofit.com/quarterly-earnings/dalmia-bharat-kei-industries-tata-technologies-south-indian-bank-q3-results-todayearnings-estimates
113,"Stocks To Watch Today: Vodafone Idea, Cipla, Oberoi Realty, TCS, Reliance Power",Avenue Supermarts and Apeejay Surrendra Park Hotels will be some of the other stocks to watch.,6.5 hours ago,— Bloomberg Quint,https://www.ndtvprofit.com/markets/stocks-to-watch-today-vodafone-idea-cipla-oberoi-realty-tcs-reliance-power
114,"Oil Holds Drop As Donald Trump Pledges Energy Push, Delays Tariffs",Brent for March settlement closed 0.8% lower at $80.15 a barrel on Monday.,6.5 hours ago,— Bloomberg Quint,https://www.ndtvprofit.com/global-economics/oil-holds-drop-as-donald-trump-pledges-energy-push-delays-tariffs
115,Tata Technologies Q3 Results Live Updates: Tata Technologies to announce its Q3 results today. Here's what to expect,,7 hours ago,— Economic Times,https://economictimes.indiatimes.com/markets/stocks/live-blog/tata-technologies-q3-results-live-q3-fy25-tata-tech-icici-prudential-indiamart-quarter-3-earning-net-profit-loss-date-time/liveblog/117410812.cms
116,US Treasuries Rally On First Trading Day Under Donald Trump Presidency,"Ten-year US Treasury yields fell as much as nine basis points in Asia on Tuesday, reflecting cautious optimism that Trump may take a more measured approach to trade relations.",7 hours ago,— Bloomberg Quint,https://www.ndtvprofit.com/markets/us-treasuries-rally-on-first-trading-day-under-donald-trump-presidency
117,Asian stocks open higher as Tariff threat eases,"Shares climbed from the open in Australia, Japan and South Korea, with the MSCI Asia Pacific Index rising as much as 0.8%. US futures extended their rally from Monday when the cash market was closed. Asian currencies strengthened as Bloomberg’s gauge of the dollar dropped for a second day. Treasuries climbed.",7 hours ago,— Economic Times,https://economictimes.indiatimes.com/markets/stocks/news/asian-stocks-open-higher-as-tariff-threat-eases/articleshow/117410734.cms
118,"Davos 2025: Vedanta 2.0 Committed To Critical Minerals, Says Hindustan Zinc's Priya Agarwal Hebbar","Hindustan Zinc has emerged as the preferred bidder for six critical mineral blocks, aligning with the Government of India's push for domestic resource development.",7 hours ago,— Bloomberg Quint,https://www.ndtvprofit.com/davos/hindustan-zinc-critical-minerals-energy-transition-expansion
119,GIFT Nifty up 70 points; here's the trading setup for today's session,"Nifty appears to be gathering momentum for an upward move. The RSI on the hourly chart has rebounded from lower levels, showing a positive divergence that further strengthens the bullish outlook.",7 hours ago,— Economic Times,https://economictimes.indiatimes.com/markets/stocks/news/pre-market-action-heres-the-trade-setup-for-todays-session/articleshow/117410663.cms
120,"Stocks in news: Tata Technologies, Reliance Power, Cipla, Vodafone Idea, Vedanta",Waaree Renewable Technologies has secured an order worth Rs 277.20 crore for setting up a ground-mounted solar project of 105 MWp (DC) capacity on a turnkey basis.,7.5 hours ago,— Economic Times,https://economictimes.indiatimes.com/markets/stocks/news/stocks-in-news-tata-technologies-reliance-power-cipla-vodafone-idea-vedanta/articleshow/117410646.cms
121,Many equity research companies calling it quits as new Sebi rules pinch,Independent research outfits provide stock advice to investors looking for under-researched investment recommendations but do not have the wherewithal to put ₹50 lakh at one go in Portfolio Management Services (PMS) or ₹1 crore in Alternative Investment Funds (AIFs).,7.5 hours ago,— Economic Times,https://economictimes.indiatimes.com/markets/stocks/news/many-equity-research-companies-calling-it-quits-as-new-sebi-rules-pinch/articleshow/117410576.cms
122,"Deal wins, focus on efficiency to help Wipro retain its margins","While the client focus remains on cost efficiency, artificial intelligence (AI)-related investments are gaining traction. Brokerages have raised the EPS estimate for FY25 by 5-7% after a strong margin performance in the December quarter.",7.5 hours ago,— Economic Times,https://economictimes.indiatimes.com/markets/stocks/news/deal-wins-focus-on-efficiency-to-help-wipro-retain-its-margins/articleshow/117410542.cms
123,Rupee gains 5 paisa to 86.567,"Brent crude oil prices fell from $82 per barrel last week to $80 per barrel due to a ceasefire in the Middle East and due to speculation that Donald Trump may ease sanctions on Russian energy exports, traders said.",8 hours ago,— Economic Times,https://economictimes.indiatimes.com/markets/forex/rupee-gains-5-paisa-to-86-567/articleshow/117410518.cms
124,"Kotak Bank surges 9% as Q3 tops expectations, brokerages positive","Kotak shares, which closed at ₹1,920.5 on Monday, gained 7.5% in the past year and 17% in five years. The Bank Nifty rose 9.6% in one year and 58% in five years.",8 hours ago,— Economic Times,https://economictimes.indiatimes.com/markets/stocks/news/kotak-bank-surges-9-as-q3-tops-expectations-brokerages-positive/articleshow/117410474.cms
125,"RBI injects Rs 76,000 crore more to boost liquidity, rein in call money rates","The ₹75,772-crore liquidity will be reversed on Tuesday. The move is aimed at easing the liquidity conditions and prevent the call money rates from shooting sharply above the current repo rate of 6.5%.",8 hours ago,— Economic Times,https://economictimes.indiatimes.com/markets/stocks/news/rbi-injects-rs-76000-crore-more-to-boost-liquidity-rein-in-call-money-rates/articleshow/117410458.cms
126,SEBI Returns Anand Rathi Share And Stock Brokers' Draft IPO Papers,"The markets regulator returned the documents on Jan. 17, without stating any reason.",13 hours ago,— Bloomberg Quint,https://www.ndtvprofit.com/markets/sebi-returns-anand-rathi-share-and-stock-brokers-draft-ipo-papers
127,Meta Will Use Fact Checkers Outside The US ‘For Now’,"Zuckerberg said this month that he decided to pull back on the practice, which was set up almost a decade ago to combat viral hoaxes spreading on the platform.",13 hours ago,— Bloomberg Quint,https://www.ndtvprofit.com/technology/meta-will-use-fact-checkers-outside-the-us-for-now
128,Gautam Adani Discusses India-Israel Collaboration With Ambassador Reuven Azar,"Gautam Adani and Israel’s Reuven Azar explored opportunities for expanding India-Israel collaboration, particularly in strategic infrastructure and defence partnerships.",13.5 hours ago,— Bloomberg Quint,https://www.ndtvprofit.com/business/gautam-adani-israel-reuven-azar-india-israel-economic-defence-ties
129,"Hitachi Energy India To Conduct Postal Ballot To Raise Rs 4,200 Crore",The voting will start at 9 a.m. on Jan. 22 and continue till 5 p.m. on Feb. 20.,14 hours ago,— Bloomberg Quint,https://www.ndtvprofit.com/markets/hitachi-energy-india-to-conduct-postal-ballot-to-raise-rs-4200-crore
130,Central Bank of India Q3 profit jumps 33% to ₹959 crore,"Central Bank of India reports 33% profit increase, improved asset quality, and successful bid for Future Genarali India Insurance Company",14 hours ago,— The Hindu Business,https://www.thehindu.com/business/markets/central-bank-of-india-q3-profit-jumps-33-to-959-crore/article69121063.ece
131,"HUL Q3 Results Preview: Muted Quarter Likely, Volumes May Fall Sequentially","Analysts expect revenue growth to be impacted due to continued subdued demand in urban markets owing to factors like food inflation, lower wage growth and deterioration in savings.",14 hours ago,— Bloomberg Quint,https://www.ndtvprofit.com/quarterly-earnings/hul-q3-results-preview-muted-quarter-likely-volumes-may-fall-sequentially
132,Even good government polices face resistance from large businesses: Nageswaran,Chief Economic Adviser discusses challenges faced by MSMEs and resistance from large corporations in India,14 hours ago,— The Hindu Business,https://www.thehindu.com/business/Economy/even-good-government-polices-face-resistance-from-large-businesses-nageswaran/article69121062.ece
133,Agriculture ministry launches first-ever national edible oil consumption survey,The initiative comes as India - the world's largest consumer and importer of edible oils - lacks recent data on consumption patterns,14.5 hours ago,— The Hindu Business,https://www.thehindu.com/business/Economy/agriculture-ministry-launches-first-ever-national-edible-oil-consumption-survey/article69120974.ece
134,"Settlement of dues only after examining all options, RBI to ARCs","After a review, it has been decided to revise guidelines on the settlement of dues payable by the borrowers to ARCs, a Reserve Bank circular said",15 hours ago,— The Hindu Business,https://www.thehindu.com/business/settlement-of-dues-only-after-examining-all-options-rbi-to-arcs/article69120973.ece
135,BAI Proposes Salary Hike For Indian Badminton Coaches To Prevent Exodus,"Under the guidance of chief national coach Pullela Gopichand, they are also working with young talents like Tharun Mannepalli, Anmol Kharb, Anuradha Upadhyaya, and Rakshitha Ramraj.",15 hours ago,— Bloomberg Quint,https://www.ndtvprofit.com/sports/bai-proposes-salary-hike-for-indian-badminton-coaches-to-prevent-exodus
136,Reliance Power Board Approves Neeraj Parakh As CEO For Three-Year Term,His term will become effective from Monday.,15 hours ago,— Bloomberg Quint,https://www.ndtvprofit.com/business/reliance-power-board-approves-neeraj-parakh-as-ceo-for-three-year-term
137,"Bajaj Finance, Bharti Airtel Collaborate To Create Digital Platforms For Financial Services","Airtel will initially offer Bajaj Finance's retail financial products on its Airtel Thanks App for seamless and secure customer experience, and later through its nation-wide network of stores, it said.",15 hours ago,— Bloomberg Quint,https://www.ndtvprofit.com/business/bajaj-finance-bharti-airtel-collaborate-to-create-digital-platforms-for-financial-services
138,China Stresses Legal Boundaries For TikTok Amid Trump’s Acquisition Offer,TikTok has operated in the US for years and has been very popular with American users.,15 hours ago,— Bloomberg Quint,https://www.ndtvprofit.com/business/china-stresses-legal-boundaries-for-tiktok-amid-trumps-acquisition-offer
139,"Trump administration’s positives might outweigh its negatives, say global tech analysts",,15 hours ago,— The Hindu Business,https://www.thehindu.com/business/trump-administrations-positives-might-outweigh-its-negatives-say-global-tech-analysts/article69112618.ece
140,"Davos 2025: India Is A Key Growth Market For Siemens, Says CTO Peter Koerte","Essentially every product that Siemens is shipping is software enabled and the software has been most largely touched by Indian engineers, Koerte told NDTV Profit.",15 hours ago,— Bloomberg Quint,https://www.ndtvprofit.com/davos/india-is-a-key-growth-market-for-siemens-says-cto-peter-koerte
141,Chequered Flag Jan 20. Headlines At A Glance,"Today's top stories include Godrej stressing a uniform carbon tax, India surpassing China in renewable investments, Donald and Melania Trump's memecoin and more.",15.5 hours ago,— Bloomberg Quint,https://www.ndtvprofit.com/web-stories/chequered-flag-jan-20-headlines-at-a-glance
142,"Buy, Sell Or Hold: NTPC, Zomato, Kalyan Jewellers—Ask Profit","Stock market investors sought expert opinions on NTPC Ltd., Zomato, and Kalyan Jewellers, with analysts weighing in on whether to buy, sell, or hold these shares on NDTV Profit’s Ask Profit show.",15.5 hours ago,— Bloomberg Quint,https://www.ndtvprofit.com/markets/buy-sell-hold-ntpc-zomato-kalyan-jewellers-stock-analysis-ask-profit
143,"MCX Q3 Results: Profit Up 4%, Margin Expands",The commodity derivatives exchange has a market share of about 98%,16 hours ago,— Bloomberg Quint,https://www.ndtvprofit.com/quarterly-earnings/mcx-q3-results-profit-up-4-margin-expands
144,Your Guide To FII Positions For Jan. 21 Trade,FPI's were net sellers of index futures and stock options while they bought index options and stock futures.,16 hours ago,— Bloomberg Quint,https://www.ndtvprofit.com/markets/your-guide-to-fii-positions-for-jan-21-trade
145,Big Win For Vodafone Idea As Supreme Court Upholds Rs 1600 Crore Refund To The Telco,The top court dismissed the tax department’s appeal against the high court order on the ground of delay,16 hours ago,— Bloomberg Quint,https://www.ndtvprofit.com/business/big-win-for-vodafone-idea-as-supreme-court-upholds-rs-1600-crore-refund-to-the-telco
146,"IOB Q3 net profit rises 21% to ₹874 cr. on improved show, asset quality",,16.5 hours ago,— The Hindu Business,https://www.thehindu.com/business/iob-q3-net-profit-rises-21-to-874-cr-on-improved-show-asset-quality/article69120345.ece
147,"Sebi proposes broader definition of NPOs, expanded activities under Social Enterprise",Markets regulator Sebi on Monday proposed broadening the definition of Not-for-Profit Organizations (NPOs) and expanding eligible activities to include welfare for disadvantaged groups and promoting arts and culture as social enterprises.,16.5 hours ago,— Economic Times,https://economictimes.indiatimes.com/markets/stocks/news/sebi-proposes-broader-definition-of-npos-expanded-activities-under-social-enterprise/articleshow/117403017.cms
148,Ahead of Market: 10 things that will decide stock market action on Tuesday,"Indian markets closed higher Monday, led by gains in Kotak Mahindra Bank and Wipro after strong earnings, while Zomato's weak results weighed. Sensex gained 454 points, and Nifty rose 141 points.",17 hours ago,— Economic Times,https://economictimes.indiatimes.com/markets/stocks/news/ahead-of-market-10-things-that-will-decide-stock-market-action-on-tuesday/articleshow/117402927.cms
149,"Fintechs Switch To Direct Merchant Integration, Discontinue With Juspay",Fintech companies are switching from third-party routers and payment orchestration platforms and choosing to focus on direct integration with its merchant base.,17 hours ago,— Bloomberg Quint,https://www.ndtvprofit.com/business/fintechs-switch-to-direct-merchant-integration-discontinue-with-juspay
150,Former RBI deputy guv Jain to chair panel to evaluate bank licence applications,"The Reserve Bank of India has formed a new external committee, led by former deputy governor MK Jain, to evaluate applications for universal and small finance banks. Initial screening by the central bank will ensure eligibility, followed by the committee's assessment. This committee succeeds the one led by Shyama Gopinath, with members like Revathy Iyer and Hemant G Contractor.",17 hours ago,— Economic Times,https://economictimes.indiatimes.com/markets/stocks/news/former-rbi-deputy-guv-jain-to-chair-panel-to-evaluate-bank-licence-applications/articleshow/117410499.cms
151,"Centre lifts sugar export ban partially, industry welcomes move","Union Food Minister Pralhad Joshi says the move will ensure price stability, benefit farmers and workers, and strengthen the sugar sector",17 hours ago,— The Hindu Business,https://www.thehindu.com/business/Industry/centre-lifts-sugar-export-ban-partially-industry-welcomes-move/article69119696.ece
152,Indian Overseas Bank Q3 Earnings: Net Profit Rises 21% To Rs 874 Crore,The Chennai-based bank had earned a net profit of Rs 723 crore in the previous year's similar period.,17 hours ago,— Bloomberg Quint,https://www.ndtvprofit.com/quarterly-earnings/biz-result-iob
153,RBI’s forex chest has strength to absorb more blows to rupee,"RBI's forex reserves adequacy ratio stands strong at 236 percent, ensuring a stable rupee despite global currency pressures. With current reserves significantly higher than during the 2013 taper tantrum, there is ample scope for managed rupee depreciation without major financial stress.",17 hours ago,— Economic Times,https://economictimes.indiatimes.com/markets/forex/reserves-adequate-to-absorb-depreciation-impact-and-rbi-dollar-sales/articleshow/117410570.cms
154,"Paytm Aims To Turn Profitable In Next One–Two Quarters, Says CFO",The company aims to be efficient as an organisation and drive higher revenue growth.,17.5 hours ago,— Bloomberg Quint,https://www.ndtvprofit.com/quarterly-earnings/paytm-aims-to-turn-profitable-in-next-onetwo-quarters-says-cfo
155,"Voltas, Lumax Among 18 Firms Selected In PLI Scheme For ACs, LEDs; Rs 2,299-Crore Investment Committed","These companies include 10 manufacturers of components of AC and eight manufacturers of LED lights, the commerce ministry said.",17.5 hours ago,— Bloomberg Quint,https://www.ndtvprofit.com/business/voltas-lumax-among-18-firms-selected-in-pli-scheme-for-acs-leds-rs-2299-crore-investment-committed
156,RBI Appoints New Committee To Evaluate Bank Licenses For Universal And Small Finance Banks,"The tenure of the committee, which will be for three years, will be chaired by former RBI Deputy Governor M K Jain.",18 hours ago,— Bloomberg Quint,https://www.ndtvprofit.com/business/rbi-appoints-new-committee-to-evaluate-bank-licenses-for-universal-and-small-finance-banks
157,Mahanagar Gas Board To Consider Interim Dividend On Jan. 28,"Mahanagar Gas has fixed Jan. 31, 2025 as the record date to determine shareholders eligible for the interim dividend payout.",18 hours ago,— Bloomberg Quint,https://www.ndtvprofit.com/markets/mahanagar-gas-board-to-consider-interim-dividend-on-jan-28
158,Sebi approves IPOs of Hexaware Technologies and five others,"Hexaware Technologies, a global digital and technology services firm with AI at its core, filed its DRHP in September to raise Rs 9,950 crore via an IPO, entirely an offer for sale by CA Magnum Holdings, a Carlyle Group affiliate. Hexaware, delisted from Indian bourses in 2020, provides services in design, data, AI, cloud, and more.",18 hours ago,— Economic Times,https://economictimes.indiatimes.com/markets/ipos/fpos/sebi-approves-ipos-of-hexaware-technologies-and-five-others/articleshow/117401481.cms
159,"IOB plans to dilute govt's stake by up to 2.5% to raise Rs 2,000 crore","Indian Overseas Bank plans to raise ₹2,000 crore by selling shares to institutional investors, reducing government stake. Q3FY24 net profit rose 21% YoY to ₹874 crore, driven by strong income growth.",18.5 hours ago,— Economic Times,https://economictimes.indiatimes.com/markets/stocks/earnings/iob-plans-to-dilute-govts-stake-by-up-to-2-5-to-raise-rs-2000-crore/articleshow/117401200.cms
160,"UPI-Credit Card Payment Dispute: On4Off, NPCI To Mediate On Differences","On4Off has accused NPCI of unauthorised use of its patented technology, alleging Rs100 crore in RuPay credit card transactions via UPI QR codes in October 2023 alone.",18.5 hours ago,— Bloomberg Quint,https://www.ndtvprofit.com/law-and-policy/delhi-high-court-on4off-npci-upi-credit-card-dispute-mediation
161,"Oberoi Realty Announces Third Interim Dividend For FY25, Fixes Record Date","Oberoi Realty's board has declared a third interim dividend of Rs 2 per equity share, and fixed Jan. 24 as the record date for the same.",18.5 hours ago,— Bloomberg Quint,https://www.ndtvprofit.com/quarterly-earnings/oberoi-realty-announces-third-interim-dividend-for-fy25-fixes-record-date
162,Waaree Energies Bags Major Solar-Module Contract,The renewable energy company will supply solar PV modules with a capacity of 180 megawatt peak.,19 hours ago,— Bloomberg Quint,https://www.ndtvprofit.com/business/waaree-energies-bags-major-solar-module-contract
163,Tech View: Nifty forms a bullish hammer pattern. What traders should do on Tuesday,"Om Mehra, SAMCO Securities, notes that Nifty's daily chart shows a bullish hammer pattern, hinting at a trend reversal. After consolidating around 23,150–23,200, the index seems poised for an upward move. Positive RSI divergence and a narrowing MACD histogram indicate reduced bearish pressure, supporting potential consolidation or a minor pullback before further gains.",19 hours ago,— Economic Times,https://economictimes.indiatimes.com/markets/stocks/news/tech-view-nifty-forms-a-bullish-hammer-pattern-what-traders-should-do-on-tuesday/articleshow/117400785.cms
164,"FPIs Sell Rs 4,337 Crore, Stay Net Sellers For 12th Straight Session","The DIIs have been buyers for 23 consecutive sessions and bought stocks worth Rs 4,322 crore.",19 hours ago,— Bloomberg Quint,https://www.ndtvprofit.com/markets/fpis-sell-rs-4337-crore-stay-net-sellers-for-12th-straight-session
165,Two Sharp with ET: Zomato tanks on Q3 miss; Sensex & Nifty close in green,,19 hours ago,— Economic Times,https://economictimes.indiatimes.com/markets/stocks/news/two-sharp-with-et-zomato-tanks-on-q3-miss-sensex-nifty-close-in-green/videoshow/117400539.cms
166,MRPL Q3 Results: Net profit drops 21% YoY to Rs 309 crore,"Mangalore Refinery and Petrochemicals Ltd (MRPL) on Monday reported a 21 per cent drop in its third-quarter net profit as revenues slid, negating a rise in refinery margins.",19 hours ago,— Economic Times,https://economictimes.indiatimes.com/markets/stocks/earnings/mrpl-q3-results-net-profit-drops-21-yoy-to-rs-309-crore/articleshow/117400506.cms
167,"These 7 smallcap stocks hit fresh 52-week highs, rallied up to 55% in a month","A 52-week high is a key metric for traders and investors, indicating a stock's peak value over the past year. It helps assess the stock's market position and provides insights into its future growth potential.",19 hours ago,— Economic Times,https://economictimes.indiatimes.com/markets/stocks/news/these-7-smallcap-stocks-hit-fresh-52-week-highs-rallied-up-to-55-in-a-month/slideshow/117400381.cms
168,RBI’s new guidelines to ease business for ARCs,"RBI has revised the guidelines for asset reconstruction companies (ARCs), allowing them to settle dues with borrowers after evaluating recovery possibilities. ARCs are now required to frame a board-approved settlement policy. For accounts with over Rs 1 crore, proposals must still be reviewed by an Independent Advisory Committee (IAC). These changes aim to speed up the resolution process.",19 hours ago,— Economic Times,https://economictimes.indiatimes.com/markets/stocks/news/rbi-eases-settlement-norms-for-arcs-resolutions-could-quicken/articleshow/117410596.cms
169,"Davos 2025: Climate-Change Challenge Serious, Need Uniform Carbon Tax, Says Nadir Godrej","A uniform carbon tax collected by individual states holds the potential of effectively addressing this problem, he says.",19 hours ago,— Bloomberg Quint,https://www.ndtvprofit.com/business/davos-2025-climate-change-challenge-serious-need-uniform-carbon-tax-says-nadir-godrej
170,EV Sales Must Hit 50% By 2030 To Meet Net Zero Goal: Bhupender Yadav,The Environment Minister was addressing the Third International Conference on Sustainable Circularity.,19 hours ago,— Bloomberg Quint,https://www.ndtvprofit.com/technology/ev-sales-must-hit-50-by-2030-to-meet-net-zero-goal-bhupender-yadav
171,Siemens Secures Rs 210-Crore Order For Electrification Of Sivok-Rangpo Rail Line,"Shares of Siemens closed 0.76% higher at Rs 6,136.45 apiece on the National Stock Exchange, compared to a 0.61% rise in the benchmark Nifty.",19.5 hours ago,— Bloomberg Quint,https://www.ndtvprofit.com/business/siemens-secures-rs-210-crore-order-for-electrification-of-sivok-rangpo-rail-line
172,Amitabh Bachchan Sells Duplex Apartment In Mumbai's Oshiwara For Rs 83 Crore,"The premium property is spread over a built-up area of 529.94 square metres, or about 5,704 square feet.",19.5 hours ago,— Bloomberg Quint,https://www.ndtvprofit.com/real-estate/amitabh-bachchan-sells-duplex-apartment-in-mumbais-oshiwara-for-rs-83-crore
173,Fitch upgrades Vedanta Resources' ratings with stable outlook,"Fitch has upgraded Vedanta Resources Ltd's (VRL) long-term foreign-currency issuer default rating following a ""significant reduction"" in the company's refinancing risks.",19.5 hours ago,— Economic Times,https://economictimes.indiatimes.com/markets/stocks/news/fitch-upgrades-vedanta-resources-ratings-with-stable-outlook/articleshow/117399411.cms
174,"Gold trades flat at Rs 82,000 per 10gm; silver slides Rs 500 on weak demand","Gold prices remained flat at Rs 82,000 per 10 grams in the national capital on Monday, according to the All India Sarafa Association. Traders waited for US President-elect Donald Trump's inaugural address later on Monday before placing any directional bets, marketmen said.",19.5 hours ago,— Economic Times,https://economictimes.indiatimes.com/markets/commodities/gold-trades-flat-at-rs-82000-per-10gm-silver-slides-rs-500-on-weak-demand/articleshow/117399384.cms
175,"Nazara Tech To Use Rs 495 Crore From Axana Estates For Investments, Acquisitions: CEO","According to Nitish Mittersain, the company’s vision is to obtain multiple gaming companies with well-established gaming IPs.",20 hours ago,— Bloomberg Quint,https://www.ndtvprofit.com/business/nazara-tech-to-use-rs-495-crore-from-axana-estates-for-investments-acquisitions-ceo
176,SBI General Insurance PAT skyrockets 273% in first nine months of FY25 to Rs 504 crore,"SBI General Insurance's nine-month PAT surged 273% YoY to ₹504 crore, driven by strong motor and health segment growth, improved loss ratios, and a 10.9% rise in gross written premiums.",20 hours ago,— Economic Times,https://economictimes.indiatimes.com/markets/stocks/earnings/sbi-general-insurance-pat-skyrockets-273-in-first-nine-months-of-fy25-to-rs-504-crore/articleshow/117399052.cms
