,Title,Description,Date,Source,Urls
177,Zomato Expects Losses To Continue While Quick-Commerce Competition Brakes Blinkit Margin,Zomato attributed the quarterly increase in its depreciation costs to a higher capex.,20 hours ago,— Bloomberg Quint,https://www.ndtvprofit.com/quarterly-earnings/zomato-expects-losses-to-continue-while-quick-commerce-competition-brakes-blinkit-margin
178,India at forefront of age defined by tech evolution: WEF report,The Centre for the Fourth Industrial Revolution (C4IR) India launched its 6-year impact journey report on the inaugural day of the World Economic Forum Annual meeting 2025.,20.5 hours ago,— The Hindu Business,https://www.thehindu.com/business/Economy/india-at-forefront-of-age-defined-by-tech-evolution-wef-report/article69119315.ece
179,"Stock markets rally on firm global trends, spike in Kotak Bank","Sensex and Nifty surge over 450 points, led by banking stocks; Kotak Mahindra Bank shines, global markets positive",20.5 hours ago,— The Hindu Business,https://www.thehindu.com/business/markets/stock-markets-rally-on-firm-global-trends-spike-in-kotak-bank/article69119205.ece
180,"Trade Setup For Jan. 21: Nifty Tests 23,200 As Key Support","The index gained 142 points to close at 23,345, driven by strong global cues and robust third quarter earnings on Monday.",20.5 hours ago,— Bloomberg Quint,https://www.ndtvprofit.com/markets/trade-setup-for-jan-21-nifty-tests-23200-as-key-support
181,Strides Pharma's Arm Gets US FDA Approval For Pain Relief Tablets,Strides Pharma has received the approval for Acetaminophen and Ibuprofen over-the-counter tablets of 125 mg and 250 mg from the US FDA.,20.5 hours ago,— Bloomberg Quint,https://www.ndtvprofit.com/business/strides-pharmas-arm-gets-us-fda-approval-for-pain-relief-tablets
182,Top 6 FII-favoured smallcap stocks surge over 150% in FY25,"Tracking foreign institutional investors (FIIs) can offer valuable insights, as an ETMarkets study found FIIs increased investments in 173 small-cap stocks in FY25’s first three quarters, with 16 becoming multibaggers and 6 surging over 150%.",20.5 hours ago,— Economic Times,https://economictimes.indiatimes.com/markets/stocks/news/top-6-fii-favoured-smallcap-stocks-surge-over-150-in-fy25/slideshow/117398131.cms
183,Nifty Outlook for January 20-24 seems bullish: Harshubh Mahesh Shah,,20.5 hours ago,— Economic Times,https://economictimes.indiatimes.com/markets/stocks/news/nifty-outlook-for-january-20-24-seems-bullish-harshubh-mahesh-shah/videoshow/117397839.cms
184,"Paytm reports 36% YoY fall in December operational revenue, net loss down slightly at Rs 208 crore","Paytm narrowed its Q3 net loss to ₹208.5 crore from ₹221 crore YoY, despite a 36% revenue drop to ₹1,827 crore, supported by cost-cutting measures and gains from asset sales.",21 hours ago,— Economic Times,https://economictimes.indiatimes.com/markets/stocks/earnings/paytm-reports-36-yoy-fall-in-december-operational-revenue-net-loss-down-slightly-at-rs-208-crore/articleshow/117397559.cms
185,"Davos 2025: India Overtaken China In Renewable Energy Investments, Says Dassault's Florence Verzelen","The auto market in India is also thriving, with global companies recognising the need to innovate within the country.",21 hours ago,— Bloomberg Quint,https://www.ndtvprofit.com/davos/davos-2025-india-overtaken-china-in-renewable-energy-investments-says-dassaults-florence-verzelen
186,"Stock Market Highlights: Nifty, Sensex Clock Second-Best Session Of 2025; Kotak, HDFC Bank Top Gainers","Intraday, the NSE Nifty 50 advanced 0.81% to 23,391, and the S&P BSE Sensex rose 0.91% to 77,318.9.",21 hours ago,— Bloomberg Quint,https://www.ndtvprofit.com/markets/stock-market-highlights-nifty-sensex-clock-second-best-session-of-2025-kotak-hdfc-bank-top-gainers
187,RBI Tightens Guidelines For Settlement Of Dues With Asset Reconstruction Firms,ARCs must get settlement proposals cleared by an independent advisory committee.,21 hours ago,— Bloomberg Quint,https://www.ndtvprofit.com/business/rbi-tightens-guidelines-for-settlement-of-dues-with-asset-reconstruction-firms
188,"Zomato shares plunge over 7% on PAT fall, food business slowdown","Zomato Share Price: Zomato reported a 57% drop in December quarter net profit to Rs 59 crore, down from Rs 138 crore a year ago. Sequentially, PAT fell 66% from Rs 176 crore in Q2FY25. Announced late in Monday's session, the results triggered a sell-off with over 10 crore shares traded on the NSE by market close.",21 hours ago,— Economic Times,https://economictimes.indiatimes.com/markets/stocks/news/zomato-shares-plunge-over-7-on-pat-fall-food-business-slowdown/articleshow/117396919.cms
189,"From Kotak Mahindra Bank To Wipro, SBI Life: Nifty 50 Top Gainers And Losers On Jan. 20",Kotak Mahindra Bank and Wipro saw big gains after their third-quarter results were received well by investors.,21.5 hours ago,— Bloomberg Quint,https://www.ndtvprofit.com/markets/from-kotak-mahindra-bank-to-wipro-sbi-life-nifty-50-top-gainers-and-losers-on-jan-20
190,"Zomato Q3 Results: Profit Down 66%, Misses Estimates","However, the company's revenue showed growth, increasing by 12.6% to Rs 5,045 crore for the quarter.",21.5 hours ago,— Bloomberg Quint,https://www.ndtvprofit.com/quarterly-earnings/zomato-q3-results-profit-down-66-misses-estimates
191,"Denta Water And Infra Solutions IPO: Price Band, Financials, Risks — All You Need To Know",Denta Water and Infra Solutions will use the proceeds from the IPO for meeting working capital requirements and for general corporate purpose.,21.5 hours ago,— Bloomberg Quint,https://www.ndtvprofit.com/ipos/denta-water-and-infra-solutions-ipo-price-band-financials-risks-all-you-need-to-know
192,"ICICI Securities Q3 Results: Profit climbs 8% YoY to Rs 504 crore, revenue jumps 20%","ICICI Securities reported an 8.3% YoY rise in Q3 profit at ₹504.46 crore, with revenue increasing 20% to ₹1,585.97 crore. Its delisting plans have also advanced post-NCLT approval.",21.5 hours ago,— Economic Times,https://economictimes.indiatimes.com/markets/stocks/news/icici-securities-q3-results-profit-climbs-8-yoy-to-rs-504-crore-revenue-jumps-20/articleshow/117396160.cms
193,Rupee Closes Stronger Against US Dollar After Two-Sessions Of Weakness,Oil prices fell on Monday as investors await Donald Trump's comments on Russia oil sanctions in his inauguration speech tonight.,21.5 hours ago,— Bloomberg Quint,https://www.ndtvprofit.com/markets/rupee-closes-stronger-against-us-dollar-after-two-sessions-of-weakness
194,Trump's return adds new twist to Western firms' Russia exit dilemma,,21.5 hours ago,— The Hindu Business,https://www.thehindu.com/business/analysis-trumps-return-adds-new-twist-to-western-firms-russia-exit-dilemma/article69119091.ece
195,Bank of Japan poised to raise rates to highest in 17 years,,21.5 hours ago,— The Hindu Business,https://www.thehindu.com/business/bank-of-japan-poised-to-raise-rates-to-highest-in-17-years/article69119082.ece
196,China's ageing villages face yawning healthcare gap in fragile economy,,21.5 hours ago,— The Hindu Business,https://www.thehindu.com/business/chinas-ageing-villages-face-yawning-healthcare-gap-in-fragile-economy/article69119065.ece
197,"SBI Life Insurance's Growth Looks Predictable Post Q3 Results, Analysts Say","Emkay Global has raised the target price for SBI Life Insurance's stock to Rs 1,850 from Rs 1,750 apiece, in view of favourable valuations and improved growth visibility.",22 hours ago,— Bloomberg Quint,https://www.ndtvprofit.com/markets/sbi-life-insurances-growth-looks-predictable-post-q3-results-analysts-say
198,"If Boeing deliveries were timely, more of our pilots would be flying, says Akasa Air CEO Vinay Dube",Most of the 300 pilots benched at the airline will fly by 2025 end; CEO declined to divulge number of deliveries expected this calendar year,22.5 hours ago,— The Hindu Business,https://www.thehindu.com/business/Industry/telephone-conversation-with-akasa-air-founder-and-ceo-vinay-dube/article69118972.ece
199,"IDBI Bank Q3 Results: Standalone net profit jumps 31% YoY to Rs 1,908 cr, NII rises 23%","IDBI Bank Q3 Results: The net interest income (NII) surges 23% year-on-year to Rs 4,229 crore.",22.5 hours ago,— Economic Times,https://economictimes.indiatimes.com/markets/stocks/earnings/idbi-bank-q3-results-standalone-net-profit-jumps-31-yoy-to-rs-1908-cr-nii-rises-21/articleshow/117394509.cms
200,Budget 2025: Government Moots Proposal To Relax AGR Dues Payout,"This proposal, if implemented, will come as a huge relief to the telecom companies, and especially to the debt-laden Vodafone Idea.",22.5 hours ago,— Bloomberg Quint,https://www.ndtvprofit.com/law-and-policy/budget-2025-government-moots-proposal-to-relax-agr-dues-payout
201,"IRFC Q2 Results: Profit Up 2%, Shares Rise","IRFC posted a profit of Rs 1,631 crore in the quarter ended December, as compared to Rs 1,593 crore in the same period last year",22.5 hours ago,— Bloomberg Quint,https://www.ndtvprofit.com/quarterly-earnings/irfc-q2-results-profit-up-2-shares-rise
202,Nazara Technologies To Raise Rs 495 Crore From Axana Estates; Share Price Surges Over 5%,"The shares of Nazara Technologies rose as much as 5.14% to Rs 1,075 apiece, the highest level since Jan. 10.",22.5 hours ago,— Bloomberg Quint,https://www.ndtvprofit.com/markets/nazara-technologies-to-raise-rs-495-crore-from-axana-estates-share-price-surges-over-5
203,"Maruti Suzuki, Hyundai Motor India, M&M — Motilal Oswal's Top Picks After EV Lineup In Bharat Mobility Show","India’s electric car segment is set to witness intensified competition, with players like China's BYD and Vietnam's Vinfast aiming to establish a strong presence in the market, Motilal Oswal said.",22.5 hours ago,— Bloomberg Quint,https://www.ndtvprofit.com/auto/maruti-suzuki-hyundai-motor-india-mm-motilal-oswals-top-picks-after-ev-lineup-in-bharat-mobility-show
204,Groww IPO: Parent Billionbrains Garag Seeks $8 Billion Valuation,"The company behind financial services platform Groww Invest Tech Pvt. Ltd. could proceed with an IPO this year, the people said, seizing on the momentum for share sales in India.",23 hours ago,— Bloomberg Quint,https://www.ndtvprofit.com/ipos/groww-ipo-parent-billionbrains-garag-seeks-8-billion-valuation
205,"Donald Trump Inauguration: 'In 2-3 Months, We’ll See Axis Of His Policymaking,' Says Harish Krishnan",Krishnan emphasised that the market could experience volatility driven by Trump's rhetoric and policy decisions.,23 hours ago,— Bloomberg Quint,https://www.ndtvprofit.com/markets/donald-trump-inauguration-in-2-3-months-well-see-axis-of-his-policymaking-says-harish-krishnan
206,"Rupee Woes: Airlines Brace For Profit Squeeze, International Fares May Soar","The rapidly falling rupee has already messed up costs, but what is even more worrying is that we don't have any visibility on when this will end, said Mark Martin.",23 hours ago,— Bloomberg Quint,https://www.ndtvprofit.com/business/rupee-woes-airlines-brace-for-profit-squeeze-international-fares-may-soar
207,ITC Hotels Likely To Start Trading Before Budget 2025,"While ITC has not confirmed the date of listing, a company spokesperson told NDTV Profit that it will take place within a couple of weeks, following the issuance of pending approvals.",23.5 hours ago,— Bloomberg Quint,https://www.ndtvprofit.com/markets/itc-hotels-listing-date-shares-likely-to-start-trading-before-budget-2025
208,Bitcoin Rises To Fresh Record Ahead Of Donald Trump Inauguration,"Bitcoin, second-ranked token Ether and XRP all rose rapidly on Monday morning in London, with traders counting down the hours until Trump once again assumes control of the White House.",23.5 hours ago,— Bloomberg Quint,https://www.ndtvprofit.com/crypto/bitcoin-rises-to-fresh-record-ahead-of-donald-trump-inauguration
209,Brent crude slips 0.35% to $80.51 as investors eye Trump move on Russian export curbs,Oil prices fell on Monday as expectations of U.S. President-elect Donald Trump relaxing curbs on Russia's energy sector in exchange for a deal to end the Ukraine war offset concern of supply disruption from harsher sanctions.,23.5 hours ago,— Economic Times,https://economictimes.indiatimes.com/markets/commodities/news/brent-crude-slips-0-35-to-80-51-as-investors-eye-trump-move-on-russian-export-curbs/articleshow/117392588.cms
210,"Trump To Declare National Energy Emergency, Unlocking New Powers","Trump would enable new oil and gas development on federal lands, while directing a rollback of Biden-era climate regulations, said the people in the know.",23.5 hours ago,— Bloomberg Quint,https://www.ndtvprofit.com/world/trump-to-declare-national-energy-emergency-unlocking-new-powers
211,"New AC, LED Makers Shortlisted For PLI Scheme Commit Rs 2,300 Crore Investment","Six existing PLI beneficiaries have been upgraded to higher investment categories under the scheme's third round, committing an additional Rs 1,217 crore.",23.5 hours ago,— Bloomberg Quint,https://www.ndtvprofit.com/business/pli-scheme-new-shortlisted-ac-led-makers-commit-rs-2300-crore-investment
212,Chinese Vice President Meets Musk Before Trump Takes Office,"Han said US firms were welcome in China during the sitdown in Washington on Sunday with Musk, who is Tesla’s CEO and a member of the incoming administration.",1 day ago,— Bloomberg Quint,https://www.ndtvprofit.com/world/chinese-vice-president-meets-musk-before-trump-takes-office
213,Neither Rupee nor stock market to look very healthy after Trump comes to power:  Swaminathan Aiyar,"Swaminathan Aiyar warns of economic challenges for India under Trump's presidency, citing potential trade tariffs and a shift to American treasuries. He advises caution in retaliating against U.S. tariffs and highlights the risks of Chinese aggression in East Asia. Additionally, Aiyar notes the impact on foreign investments, H-1B visas, and climate policies.",1 day ago,— Economic Times,https://economictimes.indiatimes.com/markets/expert-view/neither-rupee-nor-stock-market-to-look-very-healthy-after-trump-comes-to-power-swaminathan-aiyar/articleshow/117391058.cms
214,Crypto Clash: Melania takes on Trump in a high-stakes battle for digital riches,,1 day ago,— Economic Times,https://economictimes.indiatimes.com/markets/stocks/news/crypto-clash-melania-takes-on-trump-in-a-high-stakes-battle-for-digital-riches/slideshow/117391434.cms
215,Laxmi Dental shares rally over 10% after listing. What should investors do?,"Laxmi Dental shares debuted at Rs 542 on the NSE, rising 7.7% to Rs 584, with a market cap of Rs 3,119.10 crore. On the BSE, the stock opened at Rs 528, a 23.4% premium, valuing the firm at Rs 3,126 crore. The strong listing aligned with market expectations, supported by a Rs 145 grey market premium, 33.9% above the issue price.",1 day ago,— Economic Times,https://economictimes.indiatimes.com/markets/stocks/news/laxmi-dental-shares-rally-over-10-after-listing-what-should-investors-do/articleshow/117391130.cms
